id;created_at;text;lang;like;reply;retweet;view;brand;followers;following;total_tweets
1,61538E+18;17/01/2023 17:05;"2023 resolution check-in so far: \n \n✅ Drinking more water \n✅ Waking up earlier \n🚫 Buying rotisserie chicken &amp; making it past the parking lot before digging in";en;113;87;17;30388;Walmart;1363915;351;636360
1,61284E+18;10/01/2023 17:00;🚨 THREAD INCOMING 🚨  \n \nNeed some inspiration to get organized for 2023? We got you! (We won’t tell anyone you got started 10 days late. 😉) \n \nFirst, these stowaway bins are so stylish, you might think twice about storing them under your bed: https://t.co/xPv4K36ReR;en;84;85;11;40343;Walmart;1363915;351;636360
1,61039E+18;03/01/2023 22:26;To those of you who've kept at your New Year's goals so far: continue getting after it! You got this. 💪🏼💪🏿💪🏾  \n \nTo those of you who might need a li’l bit of a friendly nudge, pssssst... ➡️ https://t.co/PrKZZwtMsU;en;116;122;14;38847;Walmart;1363915;351;636360
1,60955E+18;01/01/2023 15:05;Need help with something? We’ve got all the answers at @WalmartHelp. Reach out anytime if you need assistance or have questions.  😁;en;111;116;15;42683;Walmart;1363915;351;636360
1,60922E+18;31/12/2022 17:19;Which one altered your brain chemistry in 2022...;en;51;50;6;25837;Walmart;1363915;351;636360
1,60701E+18;25/12/2022 15:05;"We’re drafting this tweet &amp; we’re checking it twice: Merry Christmas to all who celebrate! 🎄";en;415;212;35;63283;Walmart;1363915;351;636360
1,60632E+18;23/12/2022 17:05;Happy Holidays! Check out our store hours for the upcoming holidays. 🎄 Have questions? DM us! https://t.co/aqkdAx6tMX;en;143;106;32;52597;Walmart;1363915;351;636360
1,60629E+18;23/12/2022 15:05;"Legendary singer, successful chef &amp; anything @MsPattiPatti decides to share with the world next. 👑 Get to know the icon in our latest #BlackAndUnlimited episode here! ➡️ https://t.co/7iunlIe6NN https://t.co/p2fWQaZIht";en;80;32;13;27158;Walmart;1363915;351;636360
1,60599E+18;22/12/2022 19:01;"Here’s a special announcement from the set of #MissionImpossible. Join Walmart+ &amp; stream Top Gun: Maverick with a @ParamountPlus subscription. https://t.co/p5nr7KycyV https://t.co/l57fTGzn9n";en;164;35;22;52793;Walmart;1363915;351;636360
1,60526E+18;20/12/2022 19:05;"Last minute savings are on! Give the gift of Apple Watch SE (1st Gen), starting at only $199. Order today &amp; get it in time for the big morning.\n\nhttps://t.co/mR1JjMD09L https://t.co/hXQSzCkvFQ";en;98;51;9;32790;Walmart;1363915;351;636360
1,6052E+18;20/12/2022 15:05;We’re not saying Santa shops at Walmart, but we ARE saying that there have been a lot of reindeer hoof marks in the parking lot lately. You connect the dots.;en;397;105;29;55909;Walmart;1363915;351;636360
1,60454E+18;18/12/2022 19:04;"""YYYY el premio máximo es para USTEDES, miembros de Walmart +. ⚽️ \n\n¡Gracias a todos los que estuvieron con nosotros! Y si no ganaste, aún puede inscribirse para una prueba gratuita de Walmart + de 30 días: https://t.co/gKvlkRqzIT  #WalmartPlusSaves "" https://t.co/3UOQLZTMTr";es;132;61;12;40185;Walmart;1363915;351;636360
1,60454E+18;18/12/2022 18:58;"ANNND the super saver award goes to YOU, our Walmart+ members. ⚽️ \n\nThanks to all who entered &amp; watched along with us! Even If you didn’t win, you still can sign up for a free 30-day Walmart+ membership trial: https://t.co/gKvlkRIIX1  #WalmartPlusSaves https://t.co/Cu383nzS3H";en;257;88;24;37829;Walmart;1363915;351;636360
1,60454E+18;18/12/2022 18:56;When a 🦁 proves he's a 🐐. Incredible performance...career...win. 👏 👏 👏;en;283;31;23;37745;Walmart;1363915;351;636360
1,60454E+18;18/12/2022 18:54;"That makes 🔟 saves 🙌 Congrats to all our winners &amp; thank you to everyone who participated!";en;335;66;12;51257;Walmart;1363915;351;636360
1,60453E+18;18/12/2022 18:51;"🇦🇷 is on 🔥! That save might've just saved you 10¢ at the⛽️* #WalmartPlusSaves\n\nFirst 100 to enter here: https://t.co/50wTNucBdH score a FREE annual Walmart+ membership. Stnrd text &amp; data rates may apply. No pur nec. 18+ Ends 12/18. Rules: https://t.co/s9qrcnZLf0 #Sweepstakes https://t.co/8fvuTwckWZ";en;118;127;9;33818;Walmart;1363915;351;636360
1,60453E+18;18/12/2022 18:45;Heading into penalty kicks - Only. One. More. Save. To. Give. Away! Can this match get any more epic??;en;423;69;29;61198;Walmart;1363915;351;636360
1,60453E+18;18/12/2022 18:43;"That save might've just scored you free grocery delivery!* #WalmartPlusSaves\n\nFirst 100 to enter here: https://t.co/UP2sAzoipf score a FREE annual Walmart+ membership. Stnrd text &amp; data rates may apply. No pur nec. 18+ Ends 12/18. Rules: https://t.co/s9qrcnI9Qq #Sweepstakes https://t.co/iuaikiA0qO";en;154;135;16;41715;Walmart;1363915;351;636360
1,60453E+18;18/12/2022 18:30;"Which is a better save %: on the field or in-store? #WalmartPlusSaves\n\nFirst 100 to enter here: https://t.co/UBgMJsuamk score a FREE annual Walmart+ membership. Stnrd text &amp; data rates may apply. No pur nec. 18+ Ends 12/18. Rules: https://t.co/s9qrcnZLf0 #Sweepstakes https://t.co/Be9ohwzYwx";en;162;121;19;38617;Walmart;1363915;351;636360
1,60453E+18;18/12/2022 18:27;"🇫🇷 don't dribble dribble ⚽️ they fold🧤  \n#WalmartPlusSaves\n\nFirst 100 to enter here: https://t.co/kYNOsAk18I score a FREE annual Walmart+ membership. Stnrd text &amp; data rates may apply. No pur nec. 18+ Ends 12/18. Rules: https://t.co/s9qrcnI9Qq #Sweepstakes";en;147;107;14;33404;Walmart;1363915;351;636360
1,60452E+18;18/12/2022 18:12;Canceling all plans—we're going to extra time! #WorldCup;en;389;56;29;44292;Walmart;1363915;351;636360
1,60452E+18;18/12/2022 18:09;That moment when you want to give away 100 Walmart+ memberships for every save but also want your team to win. 😱 🪦;en;732;136;60;95808;Walmart;1363915;351;636360
1,60452E+18;18/12/2022 18:00;"DID. YOU. SEE. THAT. SAVE?!😱 😰 \n#WalmartPlusSaves\n\nFirst 100 to enter here: https://t.co/lOjpcnlWQu score a FREE annual Walmart+ membership. Stnrd text &amp; data rates may apply. No pur nec. 18+ Ends 12/18. Rules: https://t.co/s9qrcnZLf0  #Sweepstakes https://t.co/dLKavY2M8U";en;165;112;12;39288;Walmart;1363915;351;636360
1,60452E+18;18/12/2022 17:58;"Ole ole ole! 🇦🇷 says no way. We say FREE Walmart+ memberships. #WalmartPlusSaves\n\nFirst 100 to enter here: https://t.co/L0KNz7TL7A score a FREE annual Walmart+ membership. Stnrd text &amp; data rates may apply. No pur nec. 18+ Ends 12/18. Rules: https://t.co/s9qrcnZLf0 #Sweepstakes https://t.co/JhKttKVHlz";en;113;108;11;29946;Walmart;1363915;351;636360
1,60452E+18;18/12/2022 17:49;The cardio of these players is no joke... they must have done a lot of laps at the store;en;333;36;20;44600;Walmart;1363915;351;636360
1,60452E+18;18/12/2022 17:46;🔮 Us triangulating the position of the moon and stars to figure out how much extra time will get for this #WorldCup;en;251;56;17;31487;Walmart;1363915;351;636360
1,60452E+18;18/12/2022 17:35;"🙅‍♀️ 🥅  = 100 FREE W+ memberships up for🧤grabs! #WalmartPlusSaves \n\nFirst 100 to enter here: https://t.co/vWin2AahSk score a FREE annual Walmart+ membership. Stnrd text &amp; data rates may apply. No pur nec. 18+ Ends 12/18. Rules: https://t.co/s9qrcnZLf0 #Sweepstakes https://t.co/VFVWIVevel";en;209;155;26;42390;Walmart;1363915;351;636360
1,60451E+18;18/12/2022 17:23;"We summoned another goalie save, &amp; now you could save $1300!* #WalmartPlusSaves\n\nFirst 100 to enter here: https://t.co/S1p4QOISrv score a FREE annual Walmart+ membership. Stnrd text &amp; data rates may apply. No pur nec. 18+ Ends 12/18. Rules: https://t.co/s9qrcnI9Qq #Sweepstakes https://t.co/WaqI5NY1TT";en;191;145;29;35090;Walmart;1363915;351;636360
1,60451E+18;18/12/2022 17:18;We've all committed this foul ... #WorldCup https://t.co/jEqvlxS1Ie;en;201;42;12;21644;Walmart;1363915;351;636360
1,60451E+18;18/12/2022 17:14;Amazing save!  And we know savings....;en;287;56;18;56831;Walmart;1363915;351;636360
1,60451E+18;18/12/2022 17:12;"Think fast ⚽💨 First 100 to enter here: https://t.co/PpIKOlhDEE score a FREE annual Walmart+ membership. #WalmartPlusSaves\n\nStnrd text &amp; data rates may apply. No pur nec. 18+ Ends 12/18. Rules: https://t.co/s9qrco0j4y #Sweepstakes";en;236;150;23;39558;Walmart;1363915;351;636360
1,60451E+18;18/12/2022 17:02;An undisclosed source has informed us Smiley will be subbing in the 2nd half. https://t.co/PwyzQ1uGgY;en;268;52;21;26991;Walmart;1363915;351;636360
1,6045E+18;18/12/2022 16:31;Asked someone to explain the offside rule, now we need an explanation for the explanation #WorldCup;en;178;44;16;32647;Walmart;1363915;351;636360
1,6045E+18;18/12/2022 16:28;#WorldCup fans say it with us: https://t.co/TzyLvyCtrG;en;382;151;27;34691;Walmart;1363915;351;636360
1,6045E+18;18/12/2022 16:22;So many great hairstyles... @SmartStyleSalon did you have something to do with this? 😉;en;138;26;4;26561;Walmart;1363915;351;636360
1,6045E+18;18/12/2022 16:13;We're all about the saves today... but who doesn't love GOAAAALS!!! Which player do you think will be the top scorer? 👀;en;308;140;16;46719;Walmart;1363915;351;636360
1,60449E+18;18/12/2022 16:06;"Just us doing the 🌊 over that save! #WalmartPlusSaves\n\nFirst 100 to enter here: https://t.co/N576EAwgAS score a FREE annual Walmart+ membership. Stnrd text &amp; data rates may apply. No pur nec. 18+ Ends 12/18. Rules: https://t.co/s9qrcnZLf0 #Sweepstakes https://t.co/8JYuyzhNrV";en;207;106;30;32221;Walmart;1363915;351;636360
1,60449E+18;18/12/2022 15:58;¡Ahora 🇦🇷  contra 🇫🇷!;es;111;17;11;29450;Walmart;1363915;351;636360
1,60449E+18;18/12/2022 15:55;"We’re back for 🇦🇷 vs 🇫🇷! \nYou know the drill: 100 FREE Walmart+ memberships for every goalie save because Walmart+ can save members over $1,300 a year!*#WalmartPlusSaves \n\nStnrd text &amp; data rates may apply. No pur nec. 18+ Ends 12/18. Rules: https://t.co/s9qrcnZLf0 #Sweepstakes";en;1332;808;318;286315;Walmart;1363915;351;636360
1,60445E+18;18/12/2022 13:05;"Want more reasons to cheer? We’re giving away 100 FREE annual Walmart+ memberships anytime a goalie saves during today’s ⚽️ match! #WalmartPlusSaves \n\nStnrd text &amp; data rates may apply. No pur nec. 18+ Ends 12/18. Rules: https://t.co/YVIvl8sBOg #Sweepstakes https://t.co/BNCBAGt0kb";en;584;416;104;1414748;Walmart;1363915;351;636360
1,60417E+18;17/12/2022 18:40;Both teams are winners after this match. Same with our new Walmart+ members!;en;339;61;23;47906;Walmart;1363915;351;636360
1,60416E+18;17/12/2022 17:59;Bueno, que partido. ¡Hagámoslo de nuevo! Volveremos mañana durante la final con más membresías GRATUITAS de Walmart + para regalar. ⏰ ¡Síguenos! #WalmartPlusSaves https://t.co/RROsSmwUpd;es;88;36;10;18185;Walmart;1363915;351;636360
1,60416E+18;17/12/2022 17:57;¡Qué maravilloso momento! ¡Felicidades a la hermosa pareja futbolera! ⚽ 😍 \n\nWhat a wonderful moment! Congrats to the beautiful soccer fan couple! ⚽ 😍 https://t.co/zr4PlTB1ti;es;73;13;11;25844;Walmart;1363915;351;636360
1,60416E+18;17/12/2022 17:56;"Well, that was fun. Let’s do it again!\nWe’ll be back tomorrow during the finals with more FREE Walmart+ memberships to give away.⏰ Follow along with us! #WalmartPlusSaves\n\nStnrd text &amp; data rates may apply. No pur nec. 18+ Ends 12/18. Rules: https://t.co/tGnkMSdez2 #Sweepstakes https://t.co/j0iIHJTnYt";en;513;232;74;59088;Walmart;1363915;351;636360
1,60416E+18;17/12/2022 17:48;Just zoomed into that yellow card. It's not looking good. #WorldCup https://t.co/lyq2WGcKlG;en;229;59;21;30071;Walmart;1363915;351;636360
1,60415E+18;17/12/2022 17:33;"Wow, 🇭🇷 delivered. Just like Walmart+ does with $0 delivery!* #WalmartPlusSaves\nFirst 100 to enter here: https://t.co/CNXKRdFZvm score a FREE annual Walmart+ membership. Stnrd text &amp; data rates may apply. No pur nec. 18+ Ends 12/18. Rules: https://t.co/s9qrcnZLf0 #Sweepstakes";en;245;121;34;43841;Walmart;1363915;351;636360
1,60414E+18;17/12/2022 16:25;"🇲🇦 is on 🔥! That save might've just saved you 10¢ at the⛽️* #WalmartPlusSaves\n\nFirst 100 to enter here:https://t.co/nu0AcvwL9D score a FREE annual Walmart+ membership. Stnrd text &amp; data rates may apply. No pur nec. 18+ Ends 12/18. Rules: https://t.co/s9qrcnZLf0 #Sweepstakes https://t.co/dGjXBhbFve";en;229;88;33;42267;Walmart;1363915;351;636360
1,60413E+18;17/12/2022 16:18;"That save might've just scored you free grocery delivery!* #WalmartPlusSaves\n\nFirst 100 to enter here: https://t.co/cBSHHG3c5q score a FREE annual Walmart+ membership. Stnrd text &amp; data rates may apply. No pur nec. 18+ Ends 12/18. Rules: https://t.co/s9qrcnZLf0 #Sweepstakes https://t.co/c1l1TdH2Iz";en;214;115;39;30740;Walmart;1363915;351;636360
1,60413E+18;17/12/2022 15:58;¡El Partido Comienza 🇭🇷 contra 🇲🇦 !;es;99;17;10;19113;Walmart;1363915;351;636360
1,60413E+18;17/12/2022 15:55;"Game on 🇭🇷 vs 🇲🇦\n\nWe’re giving away 100 FREE annual Walmart+ memberships anytime a  🥅  is saved, because Walmart+ can save you $1300 a year!* #WalmartPlusSaves \nFollow us! \nStnrd text &amp; data rates may apply. No pur nec. 18+ Ends 12/18. Rules: https://t.co/tGnkMScGJu #Sweepstakes https://t.co/aYP2VpSPAw";en;945;560;222;117236;Walmart;1363915;351;636360
1,60409E+18;17/12/2022 13:11;¿Quieres más razones para celebrar? Estaremos dando 100 membresías anuales de Walmart+ GRATIS ¡por cada atajada del portero en el partido ⚽ de hoy! \n#WalmartPlusSaves\n\nAplican cargos reg. textos/msg. No comp nec. 18+ Hasta 12/18. Reglas: https://t.co/iKDdipzWsj  #Sweepstak;es;36;18;4;0;Walmart;1363915;351;636360
1,60409E+18;17/12/2022 13:11;Un gol es bueno, ¡pero una atajada también! Estaremos dando 100 membresías anuales de Walmart+ GRATIS ¡por cada atajada durante el partido ⚽ de hoy! \n#WalmartPlusSaves \n  \nAplican cargos reg. textos/msg. No comp nec. 18+ Hasta 12/17. Reglas:https://t.co/iKDdipzWsj #Sweepstakes;es;16;19;2;0;Walmart;1363915;351;636360
1,60409E+18;17/12/2022 13:05;"Goals are cool but so are SAVES, now that we’re giving away 100 FREE annual Walmart+ memberships for every goalie save during today's ⚽️ match! #WalmartPlusSaves \n\nStnrd text &amp; data rates may apply. No pur nec. 18+ Ends 12/17. Rules: https://t.co/ua4xGTO8B5 #Sweepstakes https://t.co/Ec50Df3pLF";en;497;213;85;858026;Walmart;1363915;351;636360
1,60348E+18;15/12/2022 21:00;"Looking for 🎁 gifting 🎁 inspo? Find amazing deals on exclusive &amp; limited edition movies and TV shows just in time for the holiday! Shop now: https://t.co/AFfaJ5yLTC";en;73;21;9;13957;Walmart;1363915;351;636360
1,60346E+18;15/12/2022 20:00;Cheese ✍️ puffs ✍️ can ✍️ replace ✍️ the ✍️ popcorn ✍️ garland;en;97;16;8;15802;Walmart;1363915;351;636360
1,60343E+18;15/12/2022 18:00;"Reuniting with loved ones for the holidays? Let’s celebrate happy &amp; healthy by cleaning routinely, hosting small gatherings, &amp; traveling safely. Make it your New Year’s resolution to continue your wellness journey on the Walmart Wellness Hub. https://t.co/j38zSZA6hL https://t.co/N3CrKzzban";en;78;19;7;12393;Walmart;1363915;351;636360
1,60341E+18;15/12/2022 16:39;¡Ver el partido de 🇭🇷 vs. 🇲🇦 este 17 de dic. podría ahorrarte más de $1300 este año!* Por cada atajada, daremos 100 membresías anuales de Walmart+ GRATIS.⏰¡Síguenos aquí!\n \nAplican cargos reg. textos/msg. No comp nec. 18+ Hasta 12/17. Reglas: https://t.co/iKDdipzWsj #Sweepstakes;es;0;0;0;0;Walmart;1363915;351;636360
1,60341E+18;15/12/2022 16:37;¡Ver el partido de 🇭🇷 vs. 🇲🇦 este 17 de dic. podría ahorrarte más de $1300 este año!* Por cada atajada, daremos 100 membresías anuales de Walmart+ GRATIS.⏰¡Síguenos aquí!\n \nAplican cargos reg. textos/msg. No comp nec. 18+ Hasta 12/17. Reglas: https://t.co/iKDdipzWsj #Sweepstakes;es;43;15;5;0;Walmart;1363915;351;636360
1,60341E+18;15/12/2022 16:35;¡Ver el partido de 🇭🇷 vs. 🇲🇦 este 17 de dic. podría ahorrarte más de $1300 este año!* Por cada atajada, daremos 100 membresías anuales de Walmart+ GRATIS.⏰¡Síguenos aquí! \n\nAplican cargos reg. textos/msg. No comp nec. 18+ Hasta 12/17. Reglas: https://t.co/iKDdipzWsj #Sweepstakes;es;0;0;0;0;Walmart;1363915;351;636360
1,60341E+18;15/12/2022 16:22;"Tuning in to 🇭🇷 vs. 🇲🇦 on Dec. 17 📺⚽️ could save you $1300+ this year!* For every goalie save, we’re giving away 100 FREE annual Walmart+ memberships. Follow here!\n\nStnrd text &amp; data rates may apply. No pur nec. 18+ Ends 12/17. Rules: https://t.co/s9qrcnZLf0 #Sweepstakes https://t.co/ept9aq2BFK";en;652;287;160;0;Walmart;1363915;351;636360
1,60341E+18;15/12/2022 16:19;¡Ver el partido de 🇭🇷 vs. 🇲🇦 este 17 de dic. podría ahorrarte más de $1300 este año!* Por cada atajada, daremos 100 membresías anuales de Walmart+ GRATIS.⏰¡Síguenos aquí! \nAplican cargos reg. textos/msg. No comp nec. 18+ Hasta 12/17. Reglas: https://t.co/iKDdipzWsj #Sweepstakes;es;0;0;0;0;Walmart;1363915;351;636360
1,60341E+18;15/12/2022 16:19;"Tuning in to 🇭🇷 vs. 🇲🇦 on Dec. 17 could save you $1300+ this year!* For every goalie save, we’re giving away 100 FREE annual Walmart+ memberships. Follow #WalmartPlusSaves\nStnrd text &amp; data rates may apply.\nNo pur nec. 18+ Ends 12/17. Rules: https://t.co/iKDdipzWsj #Sweepstakes!";en;0;0;0;0;Walmart;1363915;351;636360
1,60325E+18;15/12/2022 06:00;Knock out your holiday shopping with Rollbacks on gifts for the whole family.\n\n❤️ this tweet to shake up a gift idea for everyone on your list. https://t.co/RlWCwsY9gy;en;0;0;0;0;Walmart;1363915;351;636360
1,60325E+18;15/12/2022 06:00;Knock out your holiday shopping with Rollbacks on gifts for the whole family.\n\n❤️ this tweet to shake up a gift idea for everyone on your list. https://t.co/8Udfl5NCxp;en;0;0;0;0;Walmart;1363915;351;636360
1,64184E+18;31/03/2023 18:13;Want to play a game? 🎲 Try out the Funtivity app by @HermisInc to bring fun into your team meetings! https://t.co/osNmJL0ZQh https://t.co/htuNycPB5Y;en;15;4;4;5917;Zoom;1091800;2034;36207
1,64153E+18;30/03/2023 22:01;Iconic🏅💯 https://t.co/guiNkz0oyK https://t.co/UrWbXw4bAf;en;10;1;2;7540;Zoom;1091800;2034;36207
1,64149E+18;30/03/2023 19:08;Raise your hand if you’re at @MLB #OpeningDay! 🙌 See you in the @MLBReplays. https://t.co/D7XDWUWeLB;en;18;1;2;6837;Zoom;1091800;2034;36207
1,64146E+18;30/03/2023 17:08;Whether you’re at the game, in the office, at home, or tuning in somewhere else, we’ve got a virtual background for you to celebrate #OpeningDay and our partnership with @MLB! ⚾️ https://t.co/PCMNaQ5qpe;en;35;3;5;14080;Zoom;1091800;2034;36207
1,64117E+18;29/03/2023 22:04;Coming soon to a Zoom Room near you: the perfect camera angle. 🤩 Introducing, Intelligent Director! https://t.co/AsgkSs8pWE https://t.co/1F3PwDCayB;en;28;2;5;6912;Zoom;1091800;2034;36207
1,64113E+18;29/03/2023 19:08;POV: you are a Best In #EnterpriseConnect award winner! 😁😁😁 https://t.co/XF4uv65Apx;en;28;0;2;4445;Zoom;1091800;2034;36207
1,64076E+18;28/03/2023 18:52;SeND mE YoUr aVaiLAbilITy.;en;23;1;1;5933;Zoom;1091800;2034;36207
1,6407E+18;28/03/2023 15:09;Coming soon: Zoom Huddles, your video-enabled virtual coworking space for those quick questions, impromptu brainstorms, and spontaneous convos with your colleagues! 🗣️ https://t.co/AsgkSs8pWE https://t.co/FQ9CcOuBX6;en;23;0;9;5997;Zoom;1091800;2034;36207
1,64044E+18;27/03/2023 21:39;In partnership with @Zoom, we are excited to introduce Okta Authentication for End-to-End Encrypted Zoom calls.\n\nEnsure meeting attendees are who they say they are so you can collaborate with your peers, fearlessly. 👨‍💻👩‍💻🧑‍💻\n\nLearn more: https://t.co/Hvh79SY3Ps https://t.co/oUk6mM41lj;en;37;0;16;8215;Zoom;1091800;2034;36207
1,64043E+18;27/03/2023 21:05;Are you at #EnterpriseConnect this week? 👋 Stop by booth #520 and say hi to our product experts and see how our platform can help make collaborating more meaningful! https://t.co/ddr2iuEDUN;en;30;0;2;4522;Zoom;1091800;2034;36207
1,64032E+18;27/03/2023 14:01;Your workday just got easier. 📈\n\nWork smarter with expanded features from Zoom IQ, our AI-powered smart companion, and our collaboration with @OpenAI! https://t.co/ANXYy8gVdA;en;81;14;26;63907;Zoom;1091800;2034;36207
1,63929E+18;24/03/2023 16:51;"Read the room. 👀 \n\nThe Meeting Tools &amp; Metrics by @Read_CMO app is here to help you do just that in your meetings. https://t.co/PoQsNUD32R https://t.co/aOkojxggWi";en;29;4;5;8259;Zoom;1091800;2034;36207
1,63895E+18;23/03/2023 18:19;Work smarter, not harder. 💯;en;27;2;2;5858;Zoom;1091800;2034;36207
1,6388E+18;23/03/2023 08:00;Join our APAC Healthcare Summit 2023 and discover:\n💡 How leaders navigate the change toward becoming digital-first healthcare providers.\n📈 Latest trends in connected technologies that can enhance the experience for patients and providers.;en;164;24;42;0;Zoom;1091800;2034;36207
1,6388E+18;23/03/2023 08:00;How are you navigating the shift towards a digital-first healthcare with connected technologies?;en;348;34;63;0;Zoom;1091800;2034;36207
1,6388E+18;23/03/2023 08:00;Join us and explore the endless possibilities of hyperdigitalisation in healthcare. Discover how connected healthcare technologies will deliver a flexible, enhanced experience for patients and providers.;en;258;27;56;0;Zoom;1091800;2034;36207
1,6386E+18;22/03/2023 18:57;Looking good 😎. @Zoom Are y'all going home after work or it's all work work work cause these updates are straight  fire 🔥. https://t.co/tzC7oxL9bE;en;11;1;2;4001;Zoom;1091800;2034;36207
1,63822E+18;21/03/2023 18:00;🤖 @rammahesh, our head of digital customer experience, sat down with @DigCxO to talk virtual agents, advances in AI, and how the two are coming together to improve customer experiences. ➡️ https://t.co/Idr5CY2dGq https://t.co/o5bnGArCS5;en;12;0;3;3664;Zoom;1091800;2034;36207
1,63677E+18;17/03/2023 17:58;Zoom Contact Center 🤝 @MLB Replay Reviews \nhttps://t.co/ldyh81Ns24;en;16;3;2;4800;Zoom;1091800;2034;36207
1,63676E+18;17/03/2023 16:47;scheduling a meeting after 3pm on a Friday https://t.co/eAtJj9zSXj;en;29;2;6;4533;Zoom;1091800;2034;36207
1,63643E+18;16/03/2023 18:55;Did you hear? We are the Official Unified Communications Platform of @MLB! ⚾️ \n\n@MLB’s Noah Garden and Chris Marinak share the first look at our ✨home run✨ partnership powered by Zoom Contact Center! https://t.co/AWgTo1DjFX;en;31;3;9;13668;Zoom;1091800;2034;36207
1,63634E+18;16/03/2023 13:00;Now batting, the Official Unified Communications Platform of @MLB, Z⚾️⚾⚾️⚾️m! https://t.co/A7aAWPaqA3;en;46;4;15;26249;Zoom;1091800;2034;36207
1,63603E+18;15/03/2023 16:52;Create a breakout room experience your participants will love with the @WELOspace Visual Breakouts app! 😍 https://t.co/MYQuf9nbjn https://t.co/Eo6eVd8NkK;en;16;4;3;4056;Zoom;1091800;2034;36207
1,63569E+18;14/03/2023 18:29;There’s nothing hybrid about @JamfSoftware’s VP of information technology, Allen Houchins' work setup. In fact, it’s pretty much the definition of remote. 🧵 https://t.co/Uxj0tIQ9QQ;en;19;1;3;9665;Zoom;1091800;2034;36207
1,63424E+18;10/03/2023 17:53;The roadworks outside my office window whilst delivering a workshop 😱\n\nI have to take my hat off to @Zoom 🤠 Your background noise suppression is astonishingly good 🙏 https://t.co/NABqyiWiFs;en;28;3;5;5632;Zoom;1091800;2034;36207
1,63315E+18;07/03/2023 18:09;Make an impression on your customer calls with the AI business cards by @warmlyai app for Zoom! 🔥 https://t.co/Ree1igzDiN https://t.co/qKCUByFKBb;en;43;4;13;6769;Zoom;1091800;2034;36207
1,63278E+18;06/03/2023 17:35;“Our close partnership with ServiceNow is based on shared values and a shared commitment to achieve our primary goal of connecting people around the world.” - Awinash Sinha, Zoom CIO\n\nCheck out how we live up to our culture of ‘delivering happiness’ with @ServiceNow. 💙 https://t.co/4NE7fQdYaK;en;32;1;8;10504;Zoom;1091800;2034;36207
1,6317E+18;03/03/2023 18:08;"Corporate tech stack:\n💬 Chat messaging: @Zoom \n🖥️ Meetings: @Zoom \n📞 Phone &amp; SMS: @Zoom\n🧠 Whiteboard brainstorm: @Zoom \n📧 Email: @Zoom\n📆 Calendar: @Zoom\n🎟️ Hybrid events: @Zoom \n👩‍💼 Office hot desking: @Zoom\n🎧 Customer Contact Center: @Zoom \n🤖 AI chatbot: @Zoom";en;65;6;19;9626;Zoom;1091800;2034;36207
1,63136E+18;02/03/2023 19:33;Cool stuff. I can do all my mail and calendaring in Zoom now. Nice work @Zoom https://t.co/lMpK95QEJX;en;11;1;2;4091;Zoom;1091800;2034;36207
1,631E+18;01/03/2023 19:52;“We have seen our joint customers grow 250% in the last 1.5 years, which has been driven by having a best-in-class compliance and security solution for Zoom.” - @AnthonyCresci, @thetalake 🚀 https://t.co/ogX1lAvWa5;en;29;2;2;5731;Zoom;1091800;2034;36207
1,63067E+18;28/02/2023 21:32;"""AI is not new to the Zoom portfolio.""\n\nOur CFO, @ksteckel, joined @CNBC to discuss our FY23 earnings. Take a look: https://t.co/RVSBd9wQSq";en;30;3;3;16507;Zoom;1091800;2034;36207
1,63031E+18;27/02/2023 22:11;We announced our Q4 and FY23 earnings today. Tune in to the investor call. https://t.co/6o9TPNCjR1;en;19;5;4;6711;Zoom;1091800;2034;36207
1,62918E+18;24/02/2023 19:10;AI 🤝 Zoom = helping you get more done. 🚀\n\nTake a look at some of our AI innovations to smart recording, Zoom IQ for Sales, and more! https://t.co/PxlBB2CRI4;en;32;5;14;11844;Zoom;1091800;2034;36207
1,62885E+18;23/02/2023 21:27;when you realize you’ve been unmuted for the last 5 minutes https://t.co/yzJff87vRk;en;81;5;9;7630;Zoom;1091800;2034;36207
